{
  "id": "item-stol_kofeynyy_tip_1",
  "type": "coffee_round",
  "title": "Стол кофейный тип 1 Ø500x420",
  "ai": {
    "provider": "parsed-doc/mock",
    "model": "mebelgen-python-parser"
  },
  "dimensions": {
    "widthMm": 500,
    "depthMm": 500,
    "heightMm": 420,
    "diameterMm": 500
  },
  "geometry": {
    "overhangMm": 0
  },
  "parts": {
    "top": {
      "label": "Столешница",
      "material": "МДФ",
      "thicknessMm": 40,
      "colorSystem": "",
      "colorCode": "",
      "finish": "матовое"
    },
    "sidePanels": {
      "label": "Корпус",
      "material": "МДФ",
      "thicknessMm": 18,
      "colorSystem": "",
      "colorCode": ""
    },
    "pedestal": {
      "label": "Основание",
      "material": "МДФ"
    }
  },
  "features": {
    "brass": false,
    "pcHolder": false,
    "cableChannel": false,
    "pushOpen": false,
    "lock": false,
    "lockRight": false,
    "plinth": false,
    "plinthBlack": false,
    "shelves": 0,
    "drawers": 0,
    "fluted": false,
    "feltPads": true,
    "matteLacquer": true,
    "rod": false,
    "hatShelf": false,
    "shoeShelf": false
  },
  "materials": [
    "Материалы каркаса: плита МДФ. – цвет уточню у дизайнера",
    "Столешница и основание покрыто прозрачным матовым лаком",
    "На дно установлены фетровые подпятники",
    "*Фактические замеры обязательны."
  ],
  "titleBlock": {
    "sheetName": "Стол кофейный тип 1 Ø500x420",
    "date": "28.05.2026",
    "manager": "Петрова А.А."
  }
}
