{
  "id": "item-stol_kofeynyy",
  "type": "coffee_fluted",
  "title": "Стол кофейный Ø400x400",
  "ai": {
    "provider": "parsed-doc/mock",
    "model": "mebelgen-python-parser"
  },
  "dimensions": {
    "widthMm": 400,
    "depthMm": 400,
    "heightMm": 400,
    "diameterMm": 400
  },
  "geometry": {
    "overhangMm": 0
  },
  "parts": {
    "top": {
      "label": "Столешница",
      "material": "МДФ",
      "thicknessMm": 40,
      "colorSystem": "",
      "colorCode": "",
      "finish": "матовое"
    },
    "sidePanels": {
      "label": "Корпус",
      "material": "МДФ",
      "thicknessMm": 18,
      "colorSystem": "",
      "colorCode": ""
    },
    "pedestal": {
      "label": "Рифлёная поверхность",
      "material": "МДФ"
    }
  },
  "features": {
    "brass": false,
    "pcHolder": false,
    "cableChannel": false,
    "pushOpen": false,
    "lock": false,
    "lockRight": false,
    "plinth": false,
    "plinthBlack": false,
    "shelves": 0,
    "drawers": 0,
    "fluted": true,
    "feltPads": false,
    "matteLacquer": false,
    "rod": false,
    "hatShelf": false,
    "shoeShelf": false
  },
  "materials": [
    "Материал изготовления -МДФ - – цвет уточню у дизайнера, скорей всего будет",
    "Цвет по согласованию с заказчиком",
    "*Фактические замеры обязательны."
  ],
  "titleBlock": {
    "sheetName": "Стол кофейный Ø400x400",
    "date": "28.05.2026",
    "manager": "Петрова А.А."
  }
}
