{
  "id": "7-tumba_dlya_dokumentov",
  "type": "drawer_unit",
  "title": "Тумба для документов 1100x450x750",
  "ai": {
    "provider": "parsed-doc/mock",
    "model": "mebelgen-python-parser"
  },
  "dimensions": {
    "widthMm": 1100,
    "depthMm": 450,
    "heightMm": 750
  },
  "geometry": {
    "overhangMm": 0
  },
  "parts": {
    "top": {
      "label": "Корпус / столешница",
      "material": "МДФ",
      "thicknessMm": 50,
      "colorSystem": "RAL",
      "colorCode": "8019",
      "finish": "матовое"
    },
    "sidePanels": {
      "label": "Корпус",
      "material": "МДФ",
      "thicknessMm": 18,
      "colorSystem": "RAL",
      "colorCode": "8019"
    },
    "drawers": {
      "label": "Ящики",
      "count": 3,
      "material": "накладные фасады"
    },
    "plinth": {
      "label": "Цоколь",
      "material": "в цвет корпуса",
      "heightMm": 25
    }
  },
  "features": {
    "brass": false,
    "pcHolder": false,
    "cableChannel": false,
    "pushOpen": true,
    "lock": true,
    "lockRight": false,
    "plinth": true,
    "plinthBlack": false,
    "shelves": 0,
    "drawers": 3,
    "fluted": false,
    "feltPads": false,
    "matteLacquer": false,
    "rod": false,
    "hatShelf": false,
    "shoeShelf": false
  },
  "materials": [
    "Материал изготовления: МДФ под покраску цвет PPL RAL 8019",
    "столешница 50 мм, боковые части тумбы и нижний топ 25 мм. Внутренние полки 25 мм, три выдвижн",
    "*Фактические замеры обязательны."
  ],
  "titleBlock": {
    "sheetName": "Тумба для документов 1100x450x750",
    "date": "28.05.2026",
    "manager": "Петрова А.А."
  }
}
